{
  "schema": "spireagent.external-resources/registry-1",
  "checked_at": "2026-08-30",
  "source_packets": [
    {
      "packet_id": "sts2-external-ai-solver-recorder-architectures-v2-20260829",
      "filename": "CODEX_REFERENCE_STS2_EXTERNAL_AI_SOLVER_RECORDER_ARCHITECTURES_V2_20260829.md",
      "sha256": "80b052eeeaaeccf145a6b38333fcd293445014e3d1348ece7ca682e7d4e8083e",
      "checked_at": "2026-08-29",
      "authority": "reference_only"
    }
  ],
  "resources": [
    {
      "resource_id": "ritsu-metrics",
      "display_name": "RitsuMetrics",
      "kind": "live_analytics_mod",
      "canonical_urls": ["https://github.com/BAKAOLC/STS2-RitsuMetrics/tree/a056f0931aa6c1b9263ffea88d2d955910b8226a", "https://steamcommunity.com/sharedfiles/filedetails/?id=3764641362"],
      "repository_url": "https://github.com/BAKAOLC/STS2-RitsuMetrics",
      "workshop_url": "https://steamcommunity.com/sharedfiles/filedetails/?id=3764641362",
      "pinned_ref": "a056f0931aa6c1b9263ffea88d2d955910b8226a",
      "release_version": null,
      "checked_at": "2026-08-29",
      "game_compatibility": ["exact Platform Modset compatibility not qualified"],
      "runtime_platform_assumptions": ["Harmony patches inside shipped STS2"],
      "license_observed": "MPL-2.0",
      "license_source": "https://github.com/BAKAOLC/STS2-RitsuMetrics/blob/a056f0931aa6c1b9263ffea88d2d955910b8226a/LICENSE",
      "terms_observed": "file-level obligations apply to covered source",
      "reuse_policy": "independent implementation preferred",
      "authority_class": "external_reference_only",
      "adoption_status": "adopted_pattern",
      "code_policy": "clean_room_pattern",
      "platform_relevance": ["native event-first causal scopes and asynchronous persistence"],
      "stpd_relevance": ["limited analytics comparison only"],
      "workspace_relevance": ["recorder architecture reference"],
      "evidence_level": ["source_read", "license_read"],
      "hypotheses": ["narrow native owner events can replace repeated full-state lifecycle polling"],
      "experiments": ["Platform profiler separated event cost from full Player Environment capture cost"],
      "internalized_as": ["STS2-AI-PLATFORM docs/adr/0003-serialize-human-input-for-canonical-one-step-evidence.md"],
      "limitations": ["event attribution does not prove complete S, A(S), or causal S-prime"],
      "refresh_triggers": ["direct reuse review", "major hook redesign", "STS2 lifecycle change"],
      "supersedes": [],
      "superseded_by": [],
      "owning_repo_pointers": ["rsgcsg/STS2-AI-PLATFORM#3"]
    },
    {
      "resource_id": "spire-stats",
      "display_name": "SpireRunAnalytics / SpireStats",
      "kind": "live_analytics_mod",
      "canonical_urls": ["https://github.com/JonahJ5/SpireStats/tree/2fe30b3b213b9886b264970673b9b8560521ba4e"],
      "repository_url": "https://github.com/JonahJ5/SpireStats",
      "workshop_url": null,
      "pinned_ref": "2fe30b3b213b9886b264970673b9b8560521ba4e",
      "release_version": null,
      "checked_at": "2026-08-29",
      "game_compatibility": ["exact Platform compatibility not qualified"],
      "runtime_platform_assumptions": ["command-level live-game patches"],
      "license_observed": "no license found at inspected ref",
      "license_source": "bounded source audit at pinned ref",
      "terms_observed": "study only by default",
      "reuse_policy": "no source copying",
      "authority_class": "external_reference_only",
      "adoption_status": "source_audited",
      "code_policy": "architecture_study",
      "platform_relevance": ["source attribution and event-first hook topology"],
      "stpd_relevance": ["limited analytics comparison"],
      "workspace_relevance": ["license-constrained architecture reference"],
      "evidence_level": ["source_read"],
      "hypotheses": ["native command hooks preserve attribution without global snapshots"],
      "experiments": ["compare only against Platform-owned lifecycle evidence"],
      "internalized_as": [],
      "limitations": ["indirect attribution is incomplete and license is absent"],
      "refresh_triggers": ["license publication", "adoption proposal", "hook redesign"],
      "supersedes": [],
      "superseded_by": [],
      "owning_repo_pointers": []
    },
    {
      "resource_id": "sts2-ai-mcp",
      "display_name": "sts2-ai-mcp",
      "kind": "agent_connector_mod",
      "canonical_urls": ["https://github.com/BMingSY/sts2-ai-mcp/tree/5d1d36b24337d7dd27fe125682e4c51fb9f76aa0"],
      "repository_url": "https://github.com/BMingSY/sts2-ai-mcp",
      "workshop_url": null,
      "pinned_ref": "5d1d36b24337d7dd27fe125682e4c51fb9f76aa0",
      "release_version": null,
      "checked_at": "2026-08-29",
      "game_compatibility": ["exact Platform compatibility not qualified"],
      "runtime_platform_assumptions": ["live game HTTP/MCP service"],
      "license_observed": "AGPL-3.0-only",
      "license_source": "https://github.com/BMingSY/sts2-ai-mcp/blob/5d1d36b24337d7dd27fe125682e4c51fb9f76aa0/LICENSE",
      "terms_observed": "architecture study only without explicit review",
      "reuse_policy": "no Platform or STPD source copying",
      "authority_class": "external_reference_only",
      "adoption_status": "adopted_pattern",
      "code_policy": "architecture_study",
      "platform_relevance": ["decision identity, stale rejection, one in-flight lease"],
      "stpd_relevance": ["no current research integration"],
      "workspace_relevance": ["decision-window comparison"],
      "evidence_level": ["source_read", "license_read"],
      "hypotheses": ["one mutation in flight makes decision identity and stale rejection explicit"],
      "experiments": ["Platform calibration rejected fixed interactivity polling as causal proof"],
      "internalized_as": ["STS2-AI-PLATFORM docs/adr/0003-serialize-human-input-for-canonical-one-step-evidence.md"],
      "limitations": ["500 ms stability and rebuilt signatures are heuristic"],
      "refresh_triggers": ["decision service redesign", "license change", "interoperability proposal"],
      "supersedes": [],
      "superseded_by": [],
      "owning_repo_pointers": ["rsgcsg/STS2-AI-PLATFORM#3"]
    },
    {
      "resource_id": "ritsu-lib",
      "display_name": "RitsuLib",
      "kind": "mod_runtime_library",
      "canonical_urls": ["https://github.com/BAKAOLC/STS2-RitsuLib/tree/f224961a9392e010335da092240b90ee8235317f"],
      "repository_url": "https://github.com/BAKAOLC/STS2-RitsuLib",
      "workshop_url": null,
      "pinned_ref": "f224961a9392e010335da092240b90ee8235317f",
      "release_version": null,
      "checked_at": "2026-08-29",
      "game_compatibility": ["exact Platform Modset compatibility not qualified"],
      "runtime_platform_assumptions": ["shared in-process mod framework"],
      "license_observed": "MIT",
      "license_source": "https://github.com/BAKAOLC/STS2-RitsuLib/blob/f224961a9392e010335da092240b90ee8235317f/LICENSE",
      "terms_observed": "MIT notice and provenance required",
      "reuse_policy": "study first; dependency needs exact Modset audit",
      "authority_class": "candidate_dependency",
      "adoption_status": "watch",
      "code_policy": "selective_reuse_allowed",
      "platform_relevance": ["patch diagnostics, lifecycle, compatibility patterns"],
      "stpd_relevance": ["none beyond Platform behavior"],
      "workspace_relevance": ["candidate dependency requiring adoption review"],
      "evidence_level": ["source_read", "license_read"],
      "hypotheses": ["small lifecycle patterns may reduce local infrastructure"],
      "experiments": ["no dependency experiment authorized"],
      "internalized_as": [],
      "limitations": ["dependency changes exact Modset and requalification scope"],
      "refresh_triggers": ["dependency proposal", "STS2 update", "RitsuLib API release"],
      "supersedes": [],
      "superseded_by": [],
      "owning_repo_pointers": []
    },
    {
      "resource_id": "random-foreseer",
      "display_name": "Random Foreseer",
      "kind": "shadow_prediction_mod",
      "canonical_urls": ["https://github.com/hotwords123/StS2.RandomForeseer/tree/a2410e46f4d4386e0a2221cc2942479caa242d85", "https://steamcommunity.com/sharedfiles/filedetails/?id=3747531952"],
      "repository_url": "https://github.com/hotwords123/StS2.RandomForeseer",
      "workshop_url": "https://steamcommunity.com/sharedfiles/filedetails/?id=3747531952",
      "pinned_ref": "a2410e46f4d4386e0a2221cc2942479caa242d85",
      "release_version": "0.13.10",
      "checked_at": "2026-08-29",
      "game_compatibility": ["README claims minimum STS2 v0.111.0"],
      "runtime_platform_assumptions": ["live/shadow split with cloned RNG"],
      "license_observed": "no license found at inspected ref",
      "license_source": "bounded source audit at pinned ref",
      "terms_observed": "permission to Combat Solver does not extend to SpireAgent",
      "reuse_policy": "study and separately generated outputs only",
      "authority_class": "external_baseline",
      "adoption_status": "source_audited",
      "code_policy": "link_only",
      "platform_relevance": ["live/shadow separation and prediction risk"],
      "stpd_relevance": ["future counterfactual baseline with coverage"],
      "workspace_relevance": ["license and authority boundary example"],
      "evidence_level": ["source_read"],
      "hypotheses": ["simulation output must state exact, inferred, or unsupported coverage"],
      "experiments": ["exact v0.111.0 source audit found no complete arbitrary decision-boundary restore for a low-cost twin collector"],
      "internalized_as": ["STS2-AI-PLATFORM docs/evidence/NATIVE_RESTORE_AND_TWIN_RUNTIME_AUDIT_2026-08-30.md"],
      "limitations": ["simulator and RNG clone are never Platform state authority", "retained only as a differential pattern, not a primary Recorder collector"],